{
  "id": "plugin_repo.no_inline_style_tags",
  "title": "Inline <style> tags in PHP output",
  "summary": "Inline style tags in PHP-rendered output are a common WordPress.org review blocker and should be replaced with enqueued assets or properly attached inline styles.",
  "category": "plugin-repo",
  "severity": "error",
  "origin": "official-plugin-check",
  "coverage": "heuristic",
  "official_sources": [
    "https://wordpress.org/plugins/plugin-check/",
    "https://github.com/WordPress/plugin-check/blob/trunk/docs/checks.md"
  ],
  "last_verified": "2026-04-07",
  "detection": {
    "strategy": "regex",
    "pattern_mode": "fixed",
    "file_globs": [
      "*.php"
    ],
    "patterns": [
      "<style"
    ],
    "notes": "Current repo coverage is heuristic grep-based matching. A future engine should support suppression notes and safer context detection."
  },
  "guidance": {
    "why_it_matters": "Inline CSS is commonly flagged because WordPress plugins are expected to enqueue assets in the standard WordPress way.",
    "fix": "Move CSS to an enqueued stylesheet and use wp_add_inline_style() only when truly necessary.",
    "false_positive_risk": "Medium. Literal examples, docs, or escaped markup inside strings may be flagged.",
    "examples": [
      "wp_enqueue_style('my-plugin-admin', plugins_url('css/admin.css', __FILE__), array(), '1.0.0');",
      "wp_add_inline_style('my-plugin-admin', '.dynamic-class { color: #000; }');"
    ]
  }
}
